trait_signature,problem_signature,breeds_with_same_profile,total_raças
"Energetic, Good-Natured, Intelligent, Playful","Dental Problems, Eye Problems, Skin allergies","Affenpinscher, Basenji, Border Collie, Cairn Terrier, Cardigan Welsh Corgi, Chesapeake Bay Retriever, English Springer Spaniel, Field Spaniel, Finnish Spitz, Flat-Coated Retriever, Harrier, Irish Terrier, Irish Water Spaniel, Italian Greyhound, Jack Russell Terrier, Japanese Chin, Keeshond, Kerry Blue Terrier, Lhasa Apso, Maltese, Miniature Pinscher, Miniature Shiba Inu, Samoyed, Shetland Sheepdog, Staffordshire Bull Terrier, Vizsla, Welsh Corgi, Welsh Springer Spaniel, Welsh Terrier, Wirehaired Pointing Griffon, Xoloitzcuintli, Yorkshire Terrier",32
"Energetic, Good-Natured, Intelligent, Loyal","Dental Problems, Eye Problems, Skin allergies","Africanis, Akita, American Bulldog, Anatolian Shepherd, Australian Kelpie, Australian Stumpy Tail Cattle Dog, Belgian Tervuren, Bloodhound, Bull Terrier, Cane Corso, Catahoula Leopard Dog, Giant Schnauzer, Kuvasz, Pharaoh Hound, Saluki, Whippet",16
"Active, Affectionate, Hypoallergenic, Intelligent","Bladder Stones, Epilepsy, Hip Dysplasia","Miniature Poodle, Poodle, Standard Poodle, Toy Poodle",4
"Energetic, Good-Natured, Intelligent, Playful","Dental Problems, Hip Dysplasia, Skin allergies","American Eskimo Dog, Border Terrier, Coton de Tulear, English Toy Spaniel",4
"Affectionate, Energetic, Good-Natured, Intelligent, Playful","Cancer, Dental Problems, Eye Problems, Hip Dysplasia, Skin allergies","English Setter, Gordon Setter, Irish Setter",3
"Energetic, Good-Natured, Intelligent, Playful","Dental Problems, Diabetes, Pancreatitis","Miniature Schnauzer, Standard Schnauzer",2
"Energetic, Good-Natured, Intelligent, Playful","Dental Problems, Eye Problems, Hip Dysplasia, Skin allergies","Australian Terrier, West Highland White Terrier",2
"Gentle, Good-Natured, Intelligent, Loyal","Cancer, Heart Conditions, Hip Dysplasia","Great Dane, Newfoundland",2
